chunk_id,article_filename,text_excerpt,implicit_gap_sentence
352,-You-can-quit----Exploring-the-efficacy-of-new_2025_Journal-of-Behavioral-an.pdf,"Secondly, 
these new warnings were not designed to generate specific emotions, 
even indirectly, such as fear, anger or discomfort (with even the opposite 
aim for some of them). Yet, even when taking this into account, the 
reaction to the new warnings was still somehow relatively weak: none of 
those warnings exceeded or even equalled the conventional regulatory 
warnings in terms of thought-provoking impact and credibility 
(although on average they fared much better for these measures than for 
others). It is also worth noting that ENDS-related warnings were 
perceived as less credible, particularly among non-smokers, indicating 
widespread scepticism regarding the role of vaping in smoking cessa -
tion. This underscores the importance of clinically validating these 
methods before advocating for a transition to ENDS. Finally, despite the benefit of novelty and the fact that they are larger 
and more visible, no alternative set of warnings outperformed conven -
tional regulatory warnings. Some new sets of warnings may have yielded 
scores not significantly different from those obtained by the regulatory 
warnings, but they varied with the measures chosen (intentions, WTP, 
perceived efficacy). Based on these data, it seems appropriate to 
conclude that the evidence shows clearly that the regulatory warnings 
are those that, for all measures, seem to perform at least as well as all 
others, if not significantly better. This general finding contrasts with 
Hoek et al. (2013) , who used a qualitative approach to show that new 
warnings based on immediate social risks are effective in young adult 
smokers (aged 18 to 30). It is however consistent with Waheed (2023)
C. Ben Lakhdar et al. Journal of Behavioral and Experimental Economics 119 (2025) 102452 
7 
who concludes that “ policy makers do not necessarily have to be con -
cerned with whether smoking cessation messages are framed in terms of 
gains or losses ” . Evidence is thus so far mixed and further research is needed. In 
particular, while none of the alternative warning types we tested 
consistently outperformed conventional ones, it remains possible that 
certain alternative motivational warnings could prove valuable for 
specific subpopulations, through improved designs, or as a complement 
to existing warnings. For instance, cognitive dissonance may influence 
smokers ’ intentions to quit (see Table 4 , the coefficient associated with 
the interaction of smoking and COMM), while also having, as…",
361,Avoiding-cognitive-inconsistency--Experimenta_2025_Journal-of-Behavioral-and.pdf,"Not least, this is the first study to examine the effects of increased 
salience of cognitive inconsistency in the context of sustainable online 
shopping — a topic of growing importance. In 2024, the global share of 
online shopping over total sales amounted to 20%, generating revenues 
of more than 4.1 trillion US$, and this share is expected to continue 
rising (van Gelder, 2024). In Germany, where this study was conducted, 
60% of the population made online purchases in 2023 (Koptyug, 2025). At the same time, online shopping has a significant environmental 
impact due to high carbon emissions, excessive packaging, resource 
consumption, and waste (Forbes, 2020; Irgini, 2024; Oceana, 2020). Addressing these challenges requires the adoption of eco-friendly 
practices in logistics, packaging, and production, as well as fair labor 
and responsible sourcing policies, all while fostering greater demand 
for sustainably produced products. However, evidence regarding the 
role of sustainability in online shopping is scarce and inconclusive: 
While some studies suggest that sustainability aspects play only a minor 
role for online shopping (Rausch et al., 2021) — possibly even less than 
for offline shopping (Ermecke et al., 2023) — others point toward an 
increased importance of sustainability (Jacobs et al., 2018). The subsequent Sections 2 and 3 explain the underlying theoretical 
model and the experimental design and hypotheses, respectively. Sec-
tion 4 describes the data employed for our empirical analysis. Section 5 
presents the results, while the last section summarizes and concludes. 2. Theoretical underpinnings
Our theoretical analysis builds upon Konow (2000) and Rabin 
(1994), who developed rational choice models in which cognitive disso-
nance negatively affects utility ‘‘because it is unpleasant’’ (Rabin, 1994, 
p. 178). Accordingly, individuals try to avoid cognitive inconsistency 
and the potentially resulting cognitive dissonance, either by adjusting 
their behavior to fit their beliefs about what is moral, or by modifying 
these beliefs to fit their behavior, that is, by deceiving themselves. Both options come at a cost: Adapting behavior may reduce utility, 
whereas changing beliefs causes cognitive unease because ‘‘there is 
likely to be a natural [...] set of beliefs about the morality of an 
activity’’ (Rabin, 1994, p. 180) and an ‘‘intellectually honest view of 
what is fair’’ (Konow, 2000, p. 1077). Individuals therefore balance the 
ma…",
363,Avoiding-cognitive-inconsistency--Experimenta_2025_Journal-of-Behavioral-and.pdf,"Subjects of group InformationBC received information on the com-
mon criticism of conventional online shopping, such as the systematic 
destruction of returned products, packaging waste ending up in the 
ocean, as well as bad working conditions (see Item ExpA4 in Appendix 
C). When providing this information, we immediately asked respon-
dents whether they had already been familiar with this criticism prior 
to the survey. The information on negative aspects of conventional 
online shopping may increase the salience of cognitive inconsistency 
when participants have a positive attitude toward sustainable produc-
tion, but subsequently choose the conventional voucher (information 
treatment): The information raises their awareness that their voucher 
choice is not in line with their values. As subjects of group Informa-
tionBC received the information before their voucher choice — and 
without being aware of the upcoming choice —, they had the oppor-
tunity to avoid cognitive inconsistency by aligning their choice with 
this information. Former studies have found that people tend to avoid 
information that might increase the salience of cognitive inconsistency 
(e.g., Dana et al., 2007; Edenbrandt et al., 2021; Matthey & Regner, 
2011; Onwezen & van der Weele, 2016). In our study, however, the 
information is forced upon them and participants have to actively 
confirm or deny to have known it before. In line with Proposition  2, we formulate
3 Note that, according to Proposition  1, this pre-decision reminder also 
increases the likelihood that individuals adapt their beliefs about their knowl-
edge of the morality of each action. However, this implication cannot be tested 
empirically in our setting. 4 Here, we deviate from our pre-analysis plan in that we expand the control 
group to increase the statistical power of our analysis (see Supplementary 
Materials, Section 7 for our power analyses): Instead of taking ReminderSD as 
control group alone, we combine the groups ReminderSD and InformationSD 
to form the control group, because subjects of both groups do not receive any 
information or reminder before the voucher choice. To check the robustness 
of the empirical results and stick to our pre-analysis plan, we only take 
ReminderSD as control group, finding that the results only change marginally 
(see Supplementary Materials, Section 4, Table 13). Journal of Behavioral and Experimental Economics 119 (2025) 102387 
3 
J. Eßer et al. Fig. 1. Experimenta…",
432,Drivers-of-tax-compliance--Survey-evidence_2025_Journal-of-Behavioral-and-Ex.pdf,"Drivers of tax compliance: Survey evidence from 1761 Greek micro-firms
Augustinos Dimitras
a , †
, Vasileios Fourlas
a , *
, Erich Kirchler
b , c
, George Peppas
a
a
School of Social Sciences, Hellenic Open University, Aristotelous 18, Patras 26335, Greece
b
Faculty of Psychology, University of Vienna, Austria
c
IHS-Institute for Advanced Studies, Vienna, Austria
ARTICLE INFO
Keywords:
Micro-business owners
Voluntary compliance
Enforced compliance
Slippery slope framework
SSF
ABSTRACT
In countries where tax compliance is low and tax evasion is widespread, the specific compliance behavior of 
micro-business owners remains poorly understood. This study addresses this gap by analyzing both voluntary 
and enforced tax compliance among a nationally representative sample of 1761 micro-business owners in Greece. Guided by the Slippery Slope Framework (SSF), we find that trust in tax authorities is closely associated with 
voluntary compliance, whereas perceptions of coercive power are primarily linked to enforced compliance. Notably, women leading micro-businesses report higher trust and stronger compliance intentions across both 
motivational types. Perceptions of fairness, legitimacy, and corruption, as well as emotional responses toward tax 
authorities, are related to trust and indirectly associated with voluntary compliance. Our findings underscore the 
central role of trust in understanding cooperative taxpayer behavior and suggest that service-oriented, trans -
parent, and fair administrative practices could support greater voluntary compliance, particularly within the 
micro-business sector. 1. Introduction
Traditional economic theories of tax compliance — most notably the 
seminal model by Allingham and Sandmo (1972) — conceptualize 
taxpayer behavior as the outcome of rational utility maximization, 
whereby individuals weigh the expected costs and benefits of evasion, 
factoring in audit probabilities and penalty rates. While analytically 
elegant, this deterrence-based approach has proven insufficient in 
explaining the persistently high levels of compliance observed even in 
low-enforcement contexts ( Andreoni et al., 1998 ; Fischer et al., 1992 ). This limitation was already acknowledged by Allingham and Sandmo 
(1972 , p. 326), who noted: 
“… may perhaps be criticized for giving too little attention to non -
pecuniary factors in the taxpayer ’ s decision on whether or not to 
evade taxes. It need hardly be stressed that in addition to the income 
lo…",
434,Drivers-of-tax-compliance--Survey-evidence_2025_Journal-of-Behavioral-and-Ex.pdf,"Trust refers to the 
belief that authorities act competently and benevolently ( Tyler, 2003 ), 
whereas power reflects the ability of authorities to detect and penalize 
noncompliance. These dimensions give rise to two complementary 
pathways: voluntary compliance, driven by intrinsic motivation and a 
A. Dimitras et al. Journal of Behavioral and Experimental Economics 119 (2025) 102480 
2 
sense of moral obligation, and enforced compliance, rooted in strategic 
behavior influenced by deterrence and monitoring ( Ryan & Deci, 2000 ). Voluntary compliance aligns with “ commitment ” postures, reflecting 
socially and morally driven behavior, whereas enforced compliance 
resembles “ resistance, ” reflecting compliance under external pressure 
( Braithwaite, 2003 ). To capture greater nuance, the extended Slippery Slope Framework 
(e-SSF; Gangl et al., 2015 ; Hofmann et al., 2014 ) differentiates between 
coercive and legitimate power and between reason-based and implicit 
trust ( Castelfranchi & Falcone, 2010 ). Coercive power, exercised 
through audits and sanctions, may increase resistance and erode trust. In 
contrast, legitimate power — grounded in professionalism, transparency, 
and public acceptance — enhances compliance and encourages reci -
procity ( Hofmann, Hartl et al., 2017 ). Trust can be further distinguished by its underlying mechanisms. Reason-based trust arises from deliberate evaluations of authorities ’ 
competence, fairness, and transparency ( Eriksen & Fallan, 1996 ; Mur -
phy, 2004 ), whereas implicit trust reflects intuitive, automatic reliance 
shaped by social norms, emotions, and patriotic sentiments ( Gangl et al., 
2016 ; Hallsworth et al., 2017 ). Although reason-based and implicit trust 
are conceptually distinct, they often reinforce one another. Neverthe -
less, implicit trust is difficult to measure reliably in tax contexts ( Gangl 
et al., 2020 ). By integrating these distinctions, the SSF and e-SSF demonstrate how 
interactions between taxpayers and authorities — shaped by trust and 
power — translate the multifaceted factors discussed in Section 2.1 into 
observable compliance outcomes. The next section applies these theo -
retical insights to examine the compliance behavior of micro-business 
owners in the Greek context. 2.3. Micro-Business owners ’ compliance behavior in the Greek context
Greece provides a compelling setting for examining tax compliance, 
as micro-business owners operate within one of the largest shadow 
e…",
440,Drivers-of-tax-compliance--Survey-evidence_2025_Journal-of-Behavioral-and-Ex.pdf,"Conversely, tax knowledge and perceived compliance norms were not 
significant predictors, diverging from studies in more educated pop -
ulations ( Braithwaite, 2003 ; Torgler, 2007 ), possibly reflecting the 
complexity and opacity of the Greek tax system ( Schneider & Enste, 
2013 ). Negative emotions - fear, anger, and anxiety - were positively 
linked to enforced compliance but negatively associated with voluntary 
compliance, supporting dual-process models of compliance ( Gangl et al., 
2013 ; Olsen et al., 2018 ; Wenzel, 2004 ). These findings underscore the need to move beyond one-size-fits-all 
approaches, considering both micro-business owners’ heterogeneity and 
contextual factors. Future research should employ longitudinal or 
experimental designs to clarify causal links between trust, coercive 
power, and compliance, investigate how enforcement strategies can 
strengthen legitimacy, minimize negative spillovers, and integrate 
behavioral and moral factors. Jointly examining trust and power path -
ways can provide deeper insight into how enforcement strategies 
interact with perceptions of authority to shape compliance behavior in 
real-world business contexts, thereby informing more tailored and 
effective policy interventions. 5.2. Strengths and limitations
Previous studies testing the SSF in Greece have often relied on 
experimental surveys with small samples, primarily comprising under -
graduate students (e.g., Batrancea et al., 2019 ; Kaplanoglou & Rapanos, 
2015 ). These designs, while valuable, provide limited real-world 
applicability, due to reliance on hypothetical scenarios and the 
absence of actual tax experience ( Batrancea et al., 2022 ; Hartl et al., 
2015 ). By contrast, this study draws on a large, nationally representative 
sample of micro-business owners operating in a real business environ -
ment, thereby enhancing the policy relevance of the findings. Nonetheless, limitations remain. First, although self-reported mea -
sures are commonly used and theoretically justified in tax compliance 
research ( Braithwaite, 2003 ), their accuracy in capturing actual 
behavior is subject to debate ( Hite, 1988 ; Onu, 2016 ; Santoro, 2021 ). To 
address this, the study employed validated, theory-driven instruments 
and implemented quality-control measures during data collection (see 
Section 3.4 ). Second, while the regression and mediation analyses were robust 
across multiple estimation techniques, the cross-sectional design limits 
c…",
443,Drivers-of-tax-compliance--Survey-evidence_2025_Journal-of-Behavioral-and-Ex.pdf,"Journal of Economic 
Behavior & Organization, 214 , 406 – 442. https://doi.org/10.1016/j.jebo.2023.08.011
Lazos, G., Pazarskis, M., Karagiorgos, A., & Koutoupis, A. (2022). The tax compliance 
cost for businesses and its key determinants: Evidence from Greek businesses. Journal of Tax Administration, 7 (1), 39 – 56 . Litina, A., & Palivos, T. (2016). Corruption, tax evasion and social values. Journal of 
Economic Behavior & Organization, 124 , 164 – 177. https://doi.org/10.1016/j. jebo.2015.09.017
MacKinnon, D. P., & Pirlott, A. G. (2015). Statistical approaches for enhancing causal 
interpretation of the M to Y relation in mediation analysis. Personality and Social 
Psychology Review, 19 (1), 30 – 43. https://doi.org/10.1177/1088868314542878
Mardhiah, M., Miranti, R., & Tanton, R. (2019). The slippery slope framework: Extending 
the analysis by investigating factors affecting trust and power . CESifo (CESifo Working 
Paper No. 7494) https://www.cesifo.org/en/publikationen/2019/working-paper/sli 
ppery-slope-framework-extending-analysis-investigating-factors . McCaffery, E. J., & Baron, J. (2004). Framing and taxation: Evaluation of tax policies 
involving household composition. Journal of Economic Psychology, 25 (6), 679 – 705. 
https://doi.org/10.1016/j.joep.2003.07.001
Muehlbacher, S., Kirchler, E., & Schwarzenberger, H. (2011). Voluntary versus enforced 
tax compliance: Empirical evidence for the “ slippery slope ” framework. European 
Journal of Law and Economics, 32 (1), 89 – 97. https://doi.org/10.1007/s10657-011- 
9236-9
Murphy, K. (2004). The role of trust in nurturing compliance: A study of accused tax 
avoiders. Law and Human Behavior, 28 (2), 187 – 209. https://doi.org/10.1023/B: 
LAHU.0000022322.94776.ca
Murphy, K., & Tyler, T. (2008). Procedural justice and compliance behaviour: The 
mediating role of emotions. European Journal of Social Psychology, 38 (4), 652 – 668. 
https://doi.org/10.1002/ejsp.502
OECD. (2022). Financing SMEs and entrepreneurs 2022 . OECD Publishing. https://doi.org/ 
10.1787/e9073a0f-en
Olsen, J., Kasper, M., Enachescu, J., Benk, S., Budak, T., & Kirchler, E. (2018). Emotions 
and tax compliance among small business owners: An experimental survey. International Review of Law and Economics, 56 , 42 – 52. https://doi.org/10.1016/j. irle.2018.05.004
Olsen, J., Kogler, C., Brandt, M. J., Dezs ˝o, L., & Kirchler, E. (2019). Are consumption 
taxes really disliked more than equivalent costs? Inconclusive results in the USA and …",
446,Elicitation-bias-in-Multiple-Price-List_2025_Journal-of-Behavioral-and-Exper.pdf,"The prospect that is kept constant in a CL may 
appear more salient, and a certain amount may also appear more salient 
than a risky prospect, especially if its value has to be recalculated in 
every row due to the changing probabilities. Certainty effect and present bias. Another useful theoretical in-
sight about how decisions over time and under risk is the perspec-
tive that only present consumption is certain while any future con-
sumption is uncertain Chakraborty, Halevy, and Saito (2020), Halevy 
(2008). Chakraborty et al. (2020) therefore suggest that present bias 
and certainty effects are closely related. In our experimental design 
we only use delayed prospects which should imply that we avoid 
present bias and certainty effects as the ‘‘sure’’ delayed amounts in our 
experiments are inherently uncertain. 2.2. Elicitation approach and bias
Presenting full CLs versus Row by Row elicitation. The presentation 
of full CLs has been associated with bias towards the middle of the lists, 
Multiple Switching Behavior (MSB), and Never Switching Behavior 
Journal of Behavioral and Experimental Economics 119 (2025) 102479
3
S.T. Holden et al. (NSB) (Andersson et al., 2016; Jack, McDermott, & Sautmann, 2022; 
Yu, Zhang, & Zuo, 2021). The extent of such biases depends not only 
on the design of the CL (complexity) but also on how they are presented 
to subjects. Some show the whole CL to the respondents, while others 
present only one row at a time to obtain a sequence of binary decisions. Charness, Eckel, Gneezy, and Kajackaite (2018) compared the re-
sults from presenting a full HL CL with presenting only one random 
row from the HL CL to subjects and investigated whether these two 
alternative approaches influence the gender differences in the elicited 
risk preference parameter. Earlier studies have found small gender 
differences with the standard HL approach when the whole list is 
presented to subjects. However, when only a single row is presented to 
subjects, the gender difference in the elicited risk preference parameter 
became much larger. They argue that subjects have more problems 
responding consistently when presented with the whole HL CL due to 
its complexity. The complexity is reduced when subjects only look at 
one row in the list, and this enhances comprehension and is therefore 
likely to reduce decision errors that may mask the true preferences. This was based on a lab experiment with well-educated subjects at 
two university campuses …",
452,Elicitation-bias-in-Multiple-Price-List_2025_Journal-of-Behavioral-and-Exper.pdf,"(a) Discount rate distributions, (b) Risk premium distributions for 𝑝(𝑤𝑖𝑛) = 0 .75, (c) Risk premium distributions for 𝑝(𝑤𝑖𝑛) = 0 .1, (d) Risk premium 
distributions for 𝑝(𝑤𝑖𝑛) = 0 .25, all by Elicitation Method. for the discount rate distributions for the pure time CLs 1–4. We also 
use standardized risk premium distributions for pure risk CLs 5, 11, and 
12 to investigate how these standardized risk premium distributions 
vary with 𝑝(𝑤𝑖𝑛). Figures 4a–d show the distributions. Fig. 4a shows 
an initial higher share of subjects with low discount rates in the T1 
treatment, in line with a starting point bias towards the top of the CLs. However, for subjects with higher discount rates, this may even have 
been reversed as T1 is also associated with a higher share of subjects 
with discount rates that are higher than 80%. Fig. 4b assesses the risk premium distribution for 𝑝(𝑤𝑖𝑛) = 0 .75
and illustrates a strong starting point bias for T1. T1 leads to the 
classification of a much higher share (0.43–0.48) of the sample as risk 
neutral or risk loving with negative risk premia than T0 and T2 (share 
0.25–0.28), which have similar risk premium distributions. A similar 
pattern is also found in Fig. 4c with 𝑝(𝑤𝑖𝑛) = 0 .1. In line with an 
inverse S-shaped 𝑤(𝑝) function, this CL has a substantially higher share 
of subjects with negative risk premiums. For T1, the bias of the starting 
point may have inflated the estimated share of risk loving subjects, 
with approximately 70% of the sample being associated with negative 
risk premia compared to T0 and T2, with 50% and 42%–43% of the 
samples with negative risk premia, respectively. Surprisingly, Fig. 4d 
with 𝑝(𝑤𝑖𝑛) = 0 .25 shows much lower differences between the three 
treatments, all of which give negative risk premiums for less than 50% 
(35%–45%) of the sample. We will further examine the significance of 
these differences with parametric models in the next section. 6.2. Parametric models
Table  6 presents linear panel data models that jointly test for start-
ing point bias and CL order bias for the different elicitation methods. The dependent variable is the lowest row number at the switch point 
for each CL of each respondent, giving 20 observations for each. The 
RE (T0) method with intermediate CL order is the base. The models 
are run as random effects models with CL fixed effects (CL FE) and 
enumerator FE. Starting from the bottom of the CL (T2) is associated 
with a significantly higher switch point …",
