chunk_id,article_filename,text_excerpt,implicit_gap_sentence
595,The-effect-of-social-distancing-on-tru_2025_Journal-of-Behavioral-and-Experi.pdf,"For the respondents who self-reported a decrease of social 
interactions between the two waves we find a stronger effect of social 
distancing on trust towards In-group members, while the null results 
are confirmed across the board. 5 Mixed evidence is also a common feature of other behavioral traits. For 
instance, risk aversion (Alsharawy et al., 2021; Harrison et al., 2021; Shachat 
et al., 2021), cooperation (Babin et al., 2021; Buso et al., 2020; Shachat et al., 
2021) and pro-social behavior (Aksoy et al., 2021; Branas-Garza et al., 2022; 
Loeschel et al., 2021). Journal of Behavioral and Experimental Economics 119 (2025) 102402 
2 
A. Filippin and N. Pace
2. The experiment
The experiment has been pre-registered at the AEA RCT Registry (ID 
AEARCTR-0005629). The sample is composed of respondents in New 
York City, Tucson (Arizona), and in the metropolitan area of Phoenix 
(Arizona). Given the impossibility of gathering people during the out-
break, the experiment was conducted online using the Prolific platform, 
in accordance with all the relevant guidelines and regulations. Subjects 
provided their explicit consent to participate and were free to withdraw 
at any time during the experiment. As a purely observational study, the 
experiment is considered automatically preapproved by the University 
of Teramo. In what follows we describe the selection of our sample, the 
experimental tasks, the design, the procedures, and a power analysis. 2.1. Selection of the study areas and screening phase
We first filtered the Prolific database in the US based on the state 
of residence of the respondents. For our treatment condition we pre-
selected only the states with a sufficiently large number of subjects and 
at the same time not having already implemented a stay-at-home policy 
at the state level or at least in large cities: Arizona, Kentucky, Florida, 
and Virginia. Subjects in these states were invited to a screening phase 
in the week March 22–March 29, 2020 with two goals. The first was 
to obtain their city of residence in order to run the In-group treatment 
(see below Section 2.3). The second was to have readily available a list 
of active and responsive participants, given our need to run Wave 1 as 
soon as the stay-at-home policy was announced in one of these states. For this second reason we also ran the screening in New York City, 
where the stay-at-home policy had already been implemented on March 
20. The screening paid $0.25 (flat) per respon…",
601,The-effect-of-social-distancing-on-tru_2025_Journal-of-Behavioral-and-Experi.pdf,"In-group Out-group
 (1) (2) (3) (4)
 Arizona 0.306*** 0.296** 0.183 0.206  
 (0.115) (0.120) (0.152) (0.157)  
 Wave2 −0.111 −0.112 0.000 −0.001  
 (0.069) (0.070) (0.057) (0.059)  
 Arizona*Wave2 (DDR) 0.073 0.075 −0.133 −0.128  
 (0.079) (0.080) (0.106) (0.107)  
 Compliant 0.129 0.118 0.065 0.033  
 (0.115) (0.124) (0.116) (0.122)  
 Compliant*Arizona −0.356** −0.365* −0.065 −0.061  
 (0.174) (0.188) (0.193) (0.204)  
 DDR*Compliant 0.181** 0.189** 0.022 0.017  
 (0.087) (0.091) (0.121) (0.123)  
 Controls No Yes No Yes  
 Constant 0.540*** 0.524*** 0.484*** 0.627*** 
 (0.090) (0.243) (0.087) (0.246)  
 DDR + DDR*Compliant 0.254** 0.264** −0.111 −0.111  
 (0.104) (0.109) (0.100) (0.102)  
 N. Obs. 202 200 208 206  
Note: Linear probability model, fixed effects. Dep. var. : Passing the money as Player 
A. Standard errors clustered at individual level are reported in parentheses. DDR: Interaction between treated group (Arizona) and treatment period (Wave2). DDR*Compliant: Interaction between DDR and Compliance to the treatment. Controls: Age, gender, nationality, mother tongue, employment and student status, risk 
tolerance. * P-val. < 0.1, ** P-val. < 0.05, *** P-val. < 0.01.
our data this channel does not appear to work in levels either. Those 
who pass as Player A in Wave 1 are not more likely to reduce social 
interactions than those who keep the dollar (Fisher exact test, P-val =
0.672). In principle, the imperfect compliance to the treatment may also 
have blurred significant effects on the other behavioral traits. Repeating 
the same exercise seen in Table  7 for risk aversion, trustworthiness, and 
solidarity shows that this is not the case. Compliant subjects are never 
characterized by a significantly different effect, and the total effect of 
the treatment remains fairly close to zero in all the circumstances (see 
Tables  C.9–C.11 in Appendix). 5. Conclusion
Previous literature provides mixed evidence about the effect of 
social distancing on individual preferences. Contributions usually rely 
upon repeated cross sections, however, in which individual hetero-
geneity and unobservable characteristics play a critical role. This is 
particularly true in a turbulent period like that of the COVID-19 out-
break. This paper investigates experimentally whether trust, trustworthi-
ness, and solidarity react to social distancing. We improve upon the 
existing literature using a panel structure and exploiting an exogenous 
manipulation of social distanci…",
630,The-honest--electricity--thief-Experimental-eviden_2025_Journal-of-Behaviora.pdf,"Instead, we use the condonement of electricity theft; it provides 
us with information of how people view this behaviour but does not 
tell us whether they actively engage in it. We are interested whether 
dishonesty levels differ between those that are strictly opposed to 
electricity theft and those that are not. We use stated social norms 
as a tool to analyse behaviour that is not socially desirable. Here, 
we use stated social norms regarding electricity theft as a proxy for 
the individual’s behaviour. We expect that people reporting that most 
people similar to oneself engage in electricity theft are also highly likely 
to engage in electricity theft themselves. We therefore anticipate that 
these people are on average less honest in the game than people who 
report that the minority of people similar to them engages in electricity 
theft. Based on the literature, we expect the social network (here defined 
as ‘‘people that are important to the respondent’’) as well as trust to play 
a major role in electricity theft. To answer our third research question 
we elicit trust level as well as injunctive norms in regard to electricity 
theft on an individual level. On the one hand, we are interested in the 
contagiousness of social norms erosion (electricity theft justified by the 
behaviour of the majority) and on the other hand, we examine whether 
an ’’access to electricity is a basic right’’ notion (electricity theft jus-
tified by poverty) is responsible for the condonement of electricity 
theft. To analyse the acceptance of electricity theft in a community, 
we ask about electricity theft in general, in how far the acceptance 
of electricity theft depends on the behaviour of the majority, and the 
socio-economic status of a person. Our survey also entails question on 
trust towards different entities such as the electricity provider or the 
government, satisfaction with electricity supply, the electricity access 
of the social network, awareness of negative effects of electricity theft 
on the local community, and general socio-economic data. Given that in the literature dishonesty in the die-in-a-cup game often 
correlates with dishonest behaviour in the ’’real world’’, the first two 
research questions intend to shed light on whether dishonesty in the 
game carries over into norms condoning electricity theft, while the 
third research question provides novel insights on the factors that shape 
social norms towards electricity theft. We run the st…",
638,The-honest--electricity--thief-Experimental-eviden_2025_Journal-of-Behaviora.pdf,"This 
indicates that the contagiousness of social norms is more likely in tight-
knit communities. The only other variable that is significant is the idea 
that not being able to afford electricity is the main driver of electricity 
theft. When looking at the awareness of negative effects of electricity 
theft we find that low quality of service and no negative effects as 
reason for electricity theft are significant in the unaware group. While 
low quality of service reduces the likelihood of condonement, no nega-
tive consequences increases the likelihood of condonement significantly 
(table A.1.2). 4.4.3. Condonement of electricity theft due to poverty
The third social norm refers to the basic rights approach by in-
cluding poverty as a justification for electricity theft. Most of our 
socio-economic variables are not significant (Table  6) but we find in 
model 4 and 5 age becomes significant. The older a person is, the less 
likely they are condoning electricity theft due to poverty. The effect of 
income is inconclusive in model 3 and not significant when we control 
for townships. Regarding trust we find that people that place high trust 
in the local government are less likely to condone electricity theft. This 
could indicate that these people trust the government to find a solution 
to the electricity access problem which would make theft due to poverty 
obsolete. We also find that trust towards neighbours increases the 
likelihood of condoning electricity theft due to poverty. This even holds 
for people who are aware of the negative consequences of electricity 
theft (table A.1.3). We also see that satisfaction with the electricity 
service reduces the probability of electricity theft condonement, but 
this effect is only significant in model 3. Again, we find that people 
who are unaware of the negative effects of electricity theft, condone 
electricity theft due to affordability issues more often than those you 
are aware of the negative effects. One reason for the lack of significant results on income could be 
that not income per se is often seen as a factor for engaging in or the 
condoning of illegal activities but rather it is income inequality (Mimmi 
& Ecer, 2010). Since income is fairly equal (the whole area is among 
the poorest in Colombia), we might not be able to detect this effect. Journal of Behavioral and Experimental Economics 119 (2025) 102457 
11 
E. Schuch et al. 5. Discussion and conclusion
We find that dishonesty levels i…",
647,Time-pressure-and-motivated-delay-effects-on-san_2025_Journal-of-Behavioral-.pdf,"delay treatment increased the effectiveness of the sanctions. Some of 
this effect may be due to individual unobserved preferences related 
to cooperation and the public goods game. The recorded responses 
indicate that upon reflection, subjects consider the sanctions as proso-
cial tools, and when faced with sanctions they give significantly more 
to the public good. The process of writing the motivation for the 
voting choice of sanctions appears to have increased the salience of 
the sanctions faced by participants, as indicated by the interaction 
coefficient between sanctions adopted (SA) and motivated delay (MD), 
though it is statistically insignificant (𝑝-value = 0 .062). This may indi-
cate a prosocial reaction to sanctions when using deliberative thought 
processes, making sanctions more effective. In the impact of motivated delay on subsequent contribution deci-
sions there may also be a motivation spillover effect due to the focus on 
motivation in the voting stage. Economic behavior is often governed by 
psychological motivations (Ring et al., 2023) and can impact behavior 
in a social dilemma through recall of emotions and context specific 
motivations (Bartke et al., 2019; Chierchia et al., 2017). Motives are 
important to social dilemma behavior and may not solely depend on 
stable unchanging preferences. Our treatment, which makes motivation 
more salient may impact contributions to the public good as it activates 
participants’ psychological motivation for providing the public good. Journal of Behavioral and Experimental Economics 119 (2025) 102403 
6 
T. Guilfoos and J.F. Suter
Fig. 3. Contributions during PGG. To investigate the impact of motives on contributions in the moti-
vated delay treatment we regress the classified topics on contributions 
in the public goods stage. The 1638 observations from Table  4 only 
contains the 273 subjects from the treatment of motivated delay with 
six PGG contribution rounds. Also, we note that our classification of 
motives, which can be found in the appendix, is coarse as it is based 
on word association with common topics. In Table  4 we find that the motivation of self-interest is negatively 
related to contributions, as expected, but reduces in significance with 
demographic controls. We also find that cooperative motivation is 
positive and statistically significant in explaining higher contributions. This is suggestive of the emotions and specific motivations for contri-
bution differences fou…",
680,What-works-in-financial-education--Experime_2025_Journal-of-Behavioral-and-E.pdf," 
Contents lists available at ScienceDirect
Journal of Behavioral and Experimental Economics
journal homepage: www.elsevier.com/locate/jbee  
What works in financial education? Experimental evidence on program 
impact
Gonzalo Llamosas García a
 ,∗, Cristina Mazas Pérez-Oleaga b
a Department of Business Administration, University of Cantabria, Avenida de los Castros s/n, 39005 Santander, Spain
b Department of Social Sciences, Universidad Europea del Atlántico, Isabel Torres 21, 39011 Santander, Spain
A R T I C L E  I N F O
Keywords:
Financial education
Systematic literature review
Quantitative analysis
Literature review
Experimental studies
Financial literacy
 A B S T R A C T
Financial education is increasingly essential for safeguarding both individual and corporate well-being. This 
study systematically reviews global financial education experiments using a dual-method framework that 
integrates a deep learning classifier with advanced multivariate statistical techniques. Our analysis indicates 
that while short-term improvements in financial literacy are common, such gains tend to diminish over time 
without ongoing reinforcement. Moreover, the limited impact of digital innovations and monetary incentives 
suggests that successful financial education depends on more than simply deploying technological solutions 
or extrinsic rewards. Overall, this review provides valuable insights into the evolving landscape of financial 
education in a dynamic economic context and underscores the need for sustainable strategies that secure lasting 
improvements in financial literacy. 1. Introduction
Financial education is widely acknowledged as a pivotal element 
on the international agenda (Kirton & Wang, 2022; OECD, 2022a). Although the COVID-19 pandemic has highlighted existing financial 
vulnerabilities and renewed the focus on financial education (Fornero & 
Lo Prete, 2023), there remains limited evidence on whether this crisis 
has triggered lasting shifts in financial literacy levels (Litterscheidt & 
Streich, 2020; Proestakis, Marandola, Lourenço, & van Bavel, 2024; 
Sconti, Caserta, & Ferrante, 2024). Recent data from OECD (2023), 
for example, reveals a concerning statistic: a substantial proportion of 
adults lacks a fundamental grasp of core financial concepts and the 
capacity to apply essential financial skills in complex scenarios. In fact, 
OECD (2023) reports that merely 34% of adults worldwide reach the 
minimum target level for financial literacy. The…",
681,What-works-in-financial-education--Experime_2025_Journal-of-Behavioral-and-E.pdf,"Indeed, randomized school-based experiments often high-
light positive impacts on financial knowledge and behavioral changes 
(Amagir, van den Brink, Groot, & Wilschut, 2022; Maldonado & De 
Witte, 2021; Rodriguez & Martinez, 2022; Sconti et al., 2024). Building 
on this evidence, recent randomized trials that deploy fully digital, 
game-based courses mark a new frontier in the field (Cannistrà et al., 
2024). However, notable gaps remain in the literature, particularly 
when it comes to systematic reviews of randomized controlled trials 
spanning multiple social and demographic contexts (Sayinzoga, Bulte, 
& Lensink, 2016). Although meta-studies such as Kaiser, Lusardi, Menkhoff, and Urban 
(2022), Kaiser and Menkhoff (2020) have thoroughly assessed the 
scope of financial education programs, our study employs a dual-
method quantitative framework that combines machine learning with 
multivariate statistical methods, examining an extensive array of ex-
perimental interventions. We adhere to the PRISMA 2020 guidelines 
(Preferred Reporting Items for Systematic Reviews and Meta-Analyses) 
to maintain transparency and reproducibility in our selection, screen-
ing, and inclusion procedures (Page et al., 2021). Drawing from major 
bibliographic sources like Scopus, Web of Science, and Google Scholar, 
we screened out articles that failed to specify a clear financial education 
component or lacked sufficient outcome data to evaluate program 
effectiveness. Ultimately, 70 empirical studies were included, allowing 
for a wide-ranging, multiangle view of financial education’ s impact on 
financial literacy. Our dual-method framework combines XGBoost, an advanced
gradient-boosting algorithm known for robustly identifying key pre-
dictive features in complex, heterogeneous datasets (Chen & Guestrin, 
2016; Natekin & Knoll, 2013), with an ordinal logistic regression to 
enhance interpretability. Specifically, XGBoost’ s capacity to model 
non-linear interactions (Zhang & Haghani, 2015) offers nuanced in-
sights into the factors driving financial education effectiveness. We 
then employ ordinal logistic regression (Agresti, 2002; Tutz, 2022) to 
address the ordered nature of our outcome categories, clarifying both 
the magnitude and direction of crucial predictors. This more granular 
approach transcends a simple comparison of differences across studies, 
analyzing in detail how each variable influences financial education, 
while also incorporating a time dimension a…",
704,When-leadership-messaging-fails-to-encourage-produc_2025_Journal-of-Behavior.pdf,"Thus, compared with the stakes in laboratory experiments, the expected 
costs and benefits associated with decision-making in the 
field — especially in the case of firms — tend to be much larger. This 
discrepancy is likely to be another factor that contributes to differences 
between the results of laboratory and field experiments. Third, the absence of a treatment effect may reflect specific limita -
tions of the message employed in our study. It is possible that the 
message failed to generate sufficient salience or motivation, either 
because of an inherently weak first-mover appeal or because recipients 
made a rational assessment that the marginal benefits of participating in 
the seminar were too low. These possibilities suggest that our null 
finding may be context-specific and indicate the need for future research 
Table 5 
Association between interest in the webinar and behaviors. (1) (2) (3) (4) (5)
Panel A: Strong interest and webinar 1
Strong 
interest in 
webinar
Not 
registered 1
Registered 
1
Not 
attended 1
Attended 
1
Total 
1
0 127 8 130 5 135
​ (94.1 %) (5.9 %) (96.3 %) (3.7 %) (67.8 
%)
1 54 10 59 5 64
​ (84.4 %) (15.6 %) (92.2 %) (7.8 %) (32.2 
%)
Total 181 18 189 10 199
​ (91.0 %) (9.0 %) (95.0 %) (5.0 %) (100 
%)
Panel B: Strong interest and webinar 2
Strong 
interest in 
webinar
Not 
registered 2
Registered 
2
Not 
attended 2
Attended 
2
Total 
2
0 115 20 123 12 135
​ (85.2 %) (14.8 %) (91.1 %) (8.9 %) (67.8 
%)
1 46 18 48 16 64
​ (71.9 %) (28.1 %) (75.0 %) (25.0 %) (32.2 
%)
Total 161 38 171 28 199
​ (80.9 %) (19.1 %) (85.9 %) (14.1 %) (100 
%)
Panel C: General interest and webinar 1
General 
interest in 
webinar
Not 
registered 1
Registered 
1
Not 
attended 1
Attended 
1
Total 
1
0 62 3 63 2 65
​ (95.4 %) (4.6 %) (96.9 %) (3.1 %) (32.7 
%)
1 119 15 126 8 134
​ (88.8 %) (11.2 %) (94.0 %) (6.0 %) (67.3 
%)
Total 181 18 189 10 199
​ (91.0 %) (9.0 %) (95.0 %) (5.0 %) (100 
%)
Panel D: General interest and webinar 2
General 
interest in 
webinar
Not 
registered 2
Registered 
2
Not 
attended 2
Attended 
2
Total 
2
0 61 4 62 3 65
​ (93.9 %) (6.2 %) (95.4 %) (4.6 %) (32.7 
%)
1 100 34 109 25 134
​ (74.6 %) (25.4 %) (81.3 %) (18.7 %) (67.3 
%)
Total 161 38 171 28 199
​ (80.9 %) (19.1 %) (85.9 %) (14.1 %) (100 
%)
Notes : Each pair of columns (e.g., Registered/Not registered, Attended/Not 
attended) reflects two possible outcomes for a binary variable. Percentages in 
parentheses denote the distribution within each row for that pair. Colu…",
707,Work-meaningfulness-and-eff_2025_Journal-of-Behavioral-and-Experimental-Econ.pdf,"Work meaningfulness and effort
Femke Cnossen
a , *
, Milena Nikolova
b
a
University of Groningen, Faculty of Spatial Sciences and GLO, Netherlands
b
University of Groningen, Faculty of Economics and Business, IZA, GLO, Brookings Institution, Netherlands
ARTICLE INFO
JEL Codes:
J01
J30
J32
J81
I30
I31
M50 
Keywords:
Meaningful work
Motivation
Non-monetary benefits of work
Labor market outcomes
Self-determination theory
ABSTRACT
Does experiencing work meaningfulness — defined as perceiving one ’ s work as personally or socially significant 
and worthwhile — influence employee effort? Drawing on self-determination theory, we define need satisfaction 
as the fulfillment of autonomy, competence, and relatedness at work. We develop a utility framework in which 
need satisfaction enhances motivation, lowers the perceived marginal cost of effort, and fosters work mean -
ingfulness, which in turn increases effort. Using original Dutch LISS panel survey data, we find that autonomy, 
competence, and relatedness are positively associated with work meaningfulness, which in turn relates to higher 
self-reported effort and stronger pro-effort attitudes. These results indicate that meaningfulness is not a fixed 
outcome but one that may be shaped by job design. This would imply that organizations can boost productivity 
and worker well-being by creating conditions that satisfy employees ’ psychological needs. Our findings 
contribute to labor economics by integrating motivation as an endogenous outcome into labor supply models and 
by providing empirical evidence on the link between meaningfulness and effort. 1. Introduction
Work meaningfulness, which we define as the extent to which in -
dividuals perceive their work as personally or socially significant, 
worthwhile, or purposeful, has garnered growing attention in the eco -
nomics literature. 1
This burgeoning body of research has advanced both 
the theoretical frameworks and empirical evidence on its determinants 
and consequences (e.g., Ashraf et al., 2025 ; Burbano et al., 2024a , 
2024b ; Cassar & Meier, 2018 ; De Neve et al., 2023 ; Nikolova & Cnossen, 
2020 ; Nikolova et al., 2023 ). Recent economic models show how non-pecuniary factors, such as 
intrinsic motivation, public service motivation, or mission alignment, 
shape worker behavior and job sorting (see Cassar & Meier, 2018 ; 
Nikolova, 2025 ; Rebitzer & Taylor, 2011 for overviews). Specifically, 
preferences-for-meaning models (e.g., Cassar & Meier, 2018 ;…",
