chunk_id,article_filename,text_excerpt,implicit_gap_sentence
236,Do-giving-voice-and-social-information-help-in_2025_Journal-of-Behavioral-an.pdf,"We also assess the 
sensitivity of results to an alternative measure of zero-sum thinking, the 
sum of each participant’s responses to the three statements. Consistent 
with results in Table  11, the aggregated indicator, not shown here for 
brevity, is negatively and significantly correlated with initial beliefs, 
but not correlated with the change in beliefs. To summarize, estimation 
results in Table  11, indicate that zero-sum thinking is associated with 
initial rent control beliefs, even after accounting for the ideology, but 
that neither one of these two traits is associated with the revision of 
the unfounded belief. A question that arises is how zero–sum thinking (in particular, 
the income zero-sum indicator, the more relevant one), ideology and 
the misconception about rent control are related. Fig. 1 suggests that 
this relationship is U-shaped: although a zero-sum mentality is more 
Journal of Behavioral and Experimental Economics 117 (2025) 102374 
17 
J. Brandts et al. Fig. 1. Zero-sum thinking and belief in rent control by ideology. Note: Sample = 361 participants in the RVVS2 condition (Refutational video + voice + disaggregated social 
information). Ideology scale: 1 = far left; 10 = far right; 11 = Don’t know. Income zero-sum indicator: ‘‘In Spain there are different groups of people according to their income 
levels. If a group becomes more wealthy, this usually comes at the expense of other groups’’. Rent control statement: ‘‘Establishing rent controls, such that rents did not exceed a 
certain amount of money, would increase the number of people who have access to housing facilities’’. frequent among left leaning participants, those on the far right also 
share this trait. This observation is in line with (Chinoy et al., 2023), 
who find that in the case of the US, individuals with highest zero–sum 
worldviews show more sympathy towards the attack to the Capitol, 
both among Democrats and Republicans. 8. Conclusions
In this paper we investigate how to communicate to citizens the 
research-based consensus among economists about the consequences 
of a certain policy, rent control, based on state of the art empirical 
evidence. This is often more challenging than correcting factual misper-
ceptions, because it involves communicating scientific knowledge about 
causal relations among variables. The challenge is even stronger when 
the scientific consensus contradicts popular beliefs, as in the case of 
the rent-control policy, and touche…",
244,Does-lobbying-discourage-individuals-from_2025_Journal-of-Behavioral-and-Exp.pdf," 
Contents lists available at ScienceDirect
Journal of Behavioral and Experimental Economics
journal homepage: www.elsevier.com/locate/jbee  
Does lobbying discourage individuals from fighting climate change? Raphael Epperson
Department of Public Finance, University of Innsbruck, Universitätsstraße 15, 6020 Innsbruck, Austria
A R T I C L E  I N F O
Link to code of analysis: https://doi.org/10.176
05/OSF.IO/ZYU85
JEL classification:
D62
H41
Q54
Keywords:
Beliefs
Climate change
Experiment
Lobbying
Pro-environmental behavior
Spillover
 A B S T R A C T
Lobbying is commonly expected to reduce climate protection. Does such a belief affect individuals’ own 
climate protection efforts? According to conditional cooperation, for example, it should discourage individuals 
from contributing. I investigate this issue of high policy relevance using an online experiment with a large 
heterogeneous sample from the German population. To identify the causal effect of citizens’ beliefs about the 
impact of lobbying on climate protection, I induce exogenous variation in these beliefs and measure subsequent 
individual behavior. I find some evidence for a discouragement effect: Expecting a more negative impact of 
lobbying reduces individual contributions to climate protection. While not all considered behaviors show a 
significant effect, treatment differences consistently point in the same direction. These results emphasize the 
risk of spillover effects through citizens’ beliefs and lend support to a more holistic approach when evaluating 
the consequences of lobbying or climate policies. 1. Introduction
Lobbying is a billion-dollar industry (OECD, 2012) that relies on 
different strategies to influence political decision-making. Previous re-
search shows that lobbying can be effective in exerting influence (e.g., 
Gawande et al., 2006; Giger & Klüver, 2016; Igan & Mishra, 2014; 
Markussen & Svendsen, 2005) and in securing substantial returns for 
the lobbying party (de Figueiredo & Silverman, 2006; Kang, 2016). For example, Kang (2016) estimates that lobbying by the energy 
sector during the 110th U.S. Congress had a significant impact on the 
enactment of policies, with the returns from lobbying expenditures 
exceeding 130 percent. In light of this evidence, it is not surprising that 
people’s perception of lobbying is rather negative. An often held belief 
is that lobbying negatively affects policy-making and primarily benefits 
businesses and politicians instead of citi…",
245,Does-lobbying-discourage-individuals-from_2025_Journal-of-Behavioral-and-Exp.pdf,"For example, participants in Group Negative are 32 percent 
more likely to expect a negative impact of lobbying on climate pro-
tection than participants in Group Positive. Exploiting this variation 
to identify the causal effect of beliefs, I find that participants who 
have been induced to hold more negative beliefs report significantly 
less contributions to climate and environmental protection for the 
post-experimental period (average treatment effect of −0.13 standard 
deviations, 95% CI: [−0.22, −0.04]). The most substantial effect comes 
from the likelihood of (not) taking a plane. However, all self-reported 
behaviors point in the same direction – i.e., more negative beliefs lead 
to less pro-climate behavior – and the effects on the joint measure 
as well as the single behavior of (not) taking a plane are robust to 
multiple hypothesis correction. While the estimated treatment effect on 
the observed contribution to carbon emission reductions also suggests 
a slightly negative impact of holding more negative beliefs, it is not 
significant at any conventional level (average treatment effect of −0.06
standard deviations, 95% CI: [−0.14, 0.03]). Hence, the results offer 
some evidence that beliefs about lobbying affect pro-climate behavior 
on the individual level, but they also suggest that the causal link might 
not be equally pronounced across the range of relevant behaviors. The paper contributes to three strands of the literature. First, it 
complements previous research on the consequences of lobbying by 
investigating a potential spillover effect that has received little at-
tention so far. Several studies investigate whether and how lobbying 
influences political decision-making (e.g., Bertrand et al., 2020; Giger 
& Klüver, 2016; Igan & Mishra, 2014; for a review, see de Figueiredo 
& Richter, 2014), including the context of environmental and climate 
policy (Gullberg, 2008; Kang, 2016; Markussen & Svendsen, 2005; 
Meng & Rode, 2019). However, little is known about whether – in 
addition to a direct impact of lobbying – the public perception of 
lobbying might cause behavioral adjustments on the individual level. This spillover can be a relevant factor in assessing the welfare effects 
of lobbying, particularly in the context of climate protection, where 
massive action of all actors is needed to mitigate the risk of severe 
consequences. Second and more generally, this paper contributes to a large litera-
ture on the determinants of pro-e…",
276,Food-waste-salience-and-task-knowledge-to-reduce-i_2025_Journal-of-Behaviora.pdf,"In contrast, information about 
the negative impacts of food waste in landfills significantly reduced 
solid food waste among university students in a dining setting (Qi & 
Roe, 2017). These studies suggest that while informational interven-
tions making people aware of the food waste problem can enhance 
attitudes and norms regarding food waste avoidance, their direct im-
pact on reducing food waste may be limited unless combined with other 
persuasive elements. In contrast, providing knowledge on how to reduce food waste has 
shown more consistent effects on food waste reduction. In a university 
canteen setting, enhancing the salience of food waste alongside offering 
smaller servings led to a 20 percent reduction in plate waste (Visschers 
et al., 2020). Within a US College, presenting a narrow menu that made 
smaller portions more accessible significantly reduced food waste (Liu 
et al., 2022). All options were equally available on both menus, but they 
differed in how easily and quickly customers could choose their dishes. In an all-you-can-eat buffet setting, informing guests that they could fill 
their plates more than once reduced food waste by 20.5 percent (Kall-
bekken & Sælen, 2013). In another experiment in a pizzeria, diners who 
were made aware of the food waste problem and guided to ask the staff 
for a pizza box significantly asked for more takeaway of their leftovers 
than in the control group (Stöckli et al., 2018). These findings indicate 
that highlighting practical knowledge in combination with enhancing 
salience or as a standalone intervention can effectively reduce food 
waste across various restaurant and canteen settings. As shown by the 
systematic meta-analysis by Lohmann et al. (2024), interventions to 
reduce food waste generally can have a range of different effect sizes, 
averaging from small to medium. Among the array of experiments, 
choice architecture interventions that target decision information, such 
as framing, often prove to be as effective, if not more, than providing 
explicit incentives. Despite the variety of studies on food waste reduction through 
information provision that makes the food waste problem more salient 
or guides consumers, significant research gaps remain. Existing studies 
predominantly focus on institutional settings such as school cafete-
rias (Martins et al., 2016; Sharma et al., 2019), university canteens 
((Nisa et al., 2021; Visschers et al., 2020), and household environ-
ments (Roe et a…",
281,Food-waste-salience-and-task-knowledge-to-reduce-i_2025_Journal-of-Behaviora.pdf,"To investigate why the sample sizes differ between the treatment 
groups, we look at the restaurant’s aggregate sales data, which provides 
a weekly overview of sales from all customers, not only the experi-
mental sample. The restaurant sold 1803 dishes in the control weeks, 
1855 while T1 was implemented, and 1407 while T2 was in place. This 
evidence, along with the fact that week 42 was a public school holiday, 
helps explain the observed differences in sample sizes between T2 and 
the other experimental groups. 3.3.4. Social desirability and demand effects
Based on self-reported behavior, social desirability bias may affect 
our survey data. Such bias could affect the estimated treatment effects 
if participants in the treatment groups systematically underreport food 
waste. While there is no formal test, we offer two indicative analyses 
using the available data. First, previous studies suggest that women 
are more prone to social desirability bias and experimenter demand 
effects (e.g. de Quidt et al., 2018; Hebert et al., 1995; Paunonen, 
2016; Tang et al., 2022). We test this prediction and estimate gender-
specific CATE, as larger treatment effects for women would support 
the concern that social desirability bias exacerbates our main results. Appendix Table B8 presents treatment effect estimates for men and 
women using self-reported food waste and the probability of order-
ing a large dish (similar to Table  4) as the outcome. We consider 
the latter a more objective and less biased behavioral measure. Both 
models suggest that the treatments are slightly more effective for men 
than women, with differences primarily significant at the 10% level. Alternative explanations for gender differences could involve variations 
in environmental attitudes and responsiveness to interventions using 
social pressure. There is, however, little evidence in the literature that 
would support the notion that women are less likely to respond to our 
intervention, which could overshadow the gender-specific differences 
linked to social desirability (e.g. Weinschenk et al., 2018). While cer-
tainly inconclusive, it would be surprising to see men showing greater 
treatment effects if prior studies are correct that women are more prone 
to social desirability, potentially driving our results. Second, while social desirability concerns the participants’ self-
image, the experience of pressure to comply with a social norm depends 
on whether participants feel observed…",
296,Moral-preferences-in-ultimatum-and-i_2025_Journal-of-Behavioral-and-Experime.pdf,"Journal of Behavioral and Experimental Economics 117 (2025) 102371
Available online 9 May 2025
2214-8043/© 2025 The Author(s). Published by Elsevier Inc. This is an open access article under the CC BY license ( http://creativecommons.org/licenses/by/4.0/). Contents lists available at ScienceDirect
Journal of Behavioral and Experimental Economics
journal homepage: www.elsevier.com/locate/jbee  
Moral preferences in ultimatum and impunity games
Valerio Capraro a
 , Ismael Rodriguez-Lara b,c
 ,∗
a Department of Psychology, University of Milan-Bicocca, Italy
b Department of Economics, Universidad de Malaga, Spain
c Economic Science Institute (ESI), Chapman University, United States of America
A R T I C L E  I N F O
JEL classification:
C91
D03
D60
D81
Keywords:
Ultimatum game
Impunity game
Moral preferences
Moral foundations theory
Individualizing dimensions
Binding dimensions
Moral suasion
 A B S T R A C T
We report on two experiments (total N = 2572) testing the role of moral preferences in one-shot, anonymous 
ultimatum and impunity games, which vary the veto power of responders. In the impunity game, if an 
offer is lower than the responder’s minimum acceptable offer, the proposer still receives his share, while the 
responder gets nothing. Study 1 is correlational and explores how moral preferences, as measured using the 
Moral Foundations Questionnaire, explain behaviour in the two games. Study 2 is causal and investigates 
the effect of moral suasion on behaviour. Regarding proposers, both studies provide evidence that moral 
preferences affect offers more in the impunity game than in the ultimatum game. For responders, Study 1 
shows that moral preferences explain behaviour similarly in both games, while Study 2 demonstrates that 
moral suasion influences behaviour more strongly in the impunity game. Exploratory analyses of the binding 
and individualizing dimensions help reconcile these results. Our findings shed light on the complex relationship 
between moral preferences and behaviour in ultimatum and impunity games. 1. Introduction
‘‘I am gonna make him an offer he cannot refuse’’. [The Godfather, 1972.] In this article, we study the role of morality in the ultimatum 
game (Güth et al., 1982) and the impunity game (Bolton & Zwick, 
1995). In our version of the ultimatum game, the proposer makes an 
offer about how to divide a sum of money between himself and the 
responder, who is asked to determine her minimum acceptable offer 
(MAO). If the propos…",
327,The-impact-of-process-automation-on_2025_Journal-of-Behavioral-and-Experimen.pdf,"HUMAN SYSTEM  
 
Non-automated – automated
𝛥 = 11.57 𝛥 = 9.86  
 (𝑝 = 0.0000) (𝑝 = 0.0001) 
 𝛥 = 10.71
 (𝑝 = 0.0000)
Note: The table shows 𝑝-values for a two-sided Wilcoxon signed-rank test/Wilcoxon 
rank-sum test if the difference could be zero. higher in the non-automated decision process than in the automated 
decision process. Hence, Hypothesis  5 (that workers will have the same 
expectation about the performance threshold in both processes) cannot 
be confirmed. Interestingly, workers anticipate a different performance threshold 
in both processes, but the actual threshold set by the managers does 
not differ significantly. As Fig. 3 shows and Table  9 confirms, the 
performance threshold set by the managers in the automated decision 
process does not differ significantly from the performance threshold set 
in the non-automated decision process in both treatments. Table 9
Differences in the managers’ performance threshold set between the Non-automated 
and the Automated decision process. HUMAN SYSTEM  
 Non-automated – automated 𝛥 = 6.76 𝛥 = − 2.65  
 (𝑝 = 0.1953) (𝑝 = 0.8511) 
 Non-automated 𝛥 = − 2.08
 (𝑝 = 0.9565)
 Automated 𝛥 = − 11.49
 (𝑝 = 0.2283)
Note: The table shows 𝑝-values for a two-sided Wilcoxon signed-rank test/Wilcoxon 
rank-sum test if the difference could be zero. The performance thresholds set in the automated decision process 
in treatment SYSTEM , however, are more dispersed than those in the 
other conditions. Managers in treatment HUMAN , who decide indepen-
dently which approach to use, also do not set significantly different 
performance thresholds than managers in treatment SYSTEM , wherein 
an automated third party randomly decides which approach to use. 6. Conclusion
The number of automated management tasks has notably increased 
recently. Here, we report a first attempt to evaluate the impact of 
such process automation on performance. More specifically, we focus 
on the perceptions of individuals regarding automated processes in 
management tasks and whether these perceptions influence human 
performance. Our study design emphasizes the impact of process au-
tomation, with a focus on process rigidity. It centers on performance 
and whether performance is influenced by who decides to automate a 
process: the direct manager or a more remote third party. Additionally, 
we investigate procedural fairness, trust in the process for receiving a 
bonus, and expectations. Journal of Behavioral and Experimental Economics 117 (2025)…",
331,The-impact-of-process-automation-on_2025_Journal-of-Behavioral-and-Experimen.pdf,"The ques-
tions were asked right after the decision and before the final performance 
was announced. The answer method used is presented in brackets. Apart 
from the first five questions, which were only presented to workers, all 
questions were asked to workers and managers. 1. Why did you choose to transfer the amount you have chosen 
to participant B in Approach BLUE (participant B knows how 
Journal of Behavioral and Experimental Economics 117 (2025) 102377 
15 
C. Strobel
much you transferred)? [Open Question] (For the answers given, 
see online data set.) 2. Why did you choose to transfer the amount you have chosen to 
participant B in Approach GREEN (participant B does not know
how much you transferred)? [Open Question] (For the answers 
given, see online data set.) 3. What do you think is the minimum amount you would have had 
to transfer to get the bonus if participant B decided to use Ap-
proach BLUE (participant B knows how much you transferred)? [Integer from 0 to 120 points] (For an analysis of the answers 
given, see Section 5.1.) 4. What do you think is the minimum amount you would have 
had to transfer to get the bonus if participant B decided to use 
Approach GREEN (participant B does not know how much you 
transferred)? [Integer from 0 to 120 points]  (For an analysis of 
the answers given, see Section 5.1.) 5. How much do you agree with this statement: ‘I think that I will 
get a bonus.’? (For an analysis of the answers given, see Appendix 
A.4.) 6. Do you consider the procedure to get the bonus to be fair? (For 
an analysis of the answers given, see Appendix  A.3.) 7. How do you see yourself: Are you a person who is willing to 
take risks or do you try to avoid taking risks? Please select a 
number on a scale from 0 to 10. The value 0 means: ‘‘not at all 
willing to take risks’’ and the value 10 means: ‘‘very willing to 
take risks’’. [scale 0 to 10]. (For an analysis of the answers given, 
see Appendix  A.7.) 8. Generally speaking, would you say that most people can be 
trusted or that you cannot be too careful in dealing with other 
people? Please select a number on a scale from 0 to 10. The value 
0 means: ‘‘can’t be too careful’’ and the value 10 means: ‘‘most 
people can be trusted’’. [Scale 0 to 10] (For an analysis of the 
answers given, see Appendix  A.7.) 9. What is your gender? (For a summary of the answers given, see 
Section 5.) 10. What is your age [in years]? [Integer ] (For a summary of the 
answers given, see Section 5.)…",
335,Using-a-brief-contact-to-improve-trust-in_2025_Journal-of-Behavioral-and-Exp.pdf,"(2019) find that a brief visit of 
a police officer to citizens’ doors to discuss methods of improvement of 
policing in their neighborhoods improves the perception of the police. The fact that no effect is found at the collective level could be an 
indication that discussions about policing are necessary to translate the 
effect toward the out-group in general, although this result would need 
to be confirmed by future research. Regarding the recurring political 
debate about proximity or community policing, results from the present 
paper imply that the contact can improve relations at the individual 
level, and might be an argument in favor of having officers patrolling 
the same neighborhoods regularly. Since interventions in different 
countries have yielded varying results (Blair et al., 2020; Peyton et al., 
2019), future research should explore whether these differences stem 
from the context or the intervention itself. Second, I contribute to the literature on the contact hypothesis. I 
show that even a brief, cheap and easy to replicate contact can have a 
positive effect on trust at the individual level, which is an advantage 
relative to previous protocols which were much longer in time, and 
therefore potentially difficult to scale-up (Lowe, 2021; Mousa, 2020; 
Scacco & Warren, 2018). The results found in this paper tend to confirm 
the results from recent meta-studies on the topic (Clochard, 2024; 
Lowe, 2025; Paluck et al., 2019), with a weaker effect of contact 
at the collective level, sometimes called generalizability effects, than 
at the individual level. I also present in the appendix a potential 
theoretical explanation, based on a theoretical framework of Bayesian 
updating, for the results, in particular if participants have had several 
(potentially negative) interactions with out-group members (Clochard, 
2024; Page-Gould et al., 2008). The heterogeneity analysis based on 
previous interactions with the outgroup is a novel finding in the contact 
literature. The remainder of the paper is organized as follows. In Section 2, 
I review the relevant literature on police-population relations and the 
contact hypothesis. In Section 3, I present the experimental design of 
the experiment I conducted and the data. I present empirical results, 
as well as a theoretical framework which can explain some findings in 
Section 4. Section 5 concludes. 2. Literature review
This paper is linked to two main strands of literature: the first is the 
…",
